FileName,Dataset,text,label2a,Starting,Ending
common_voice_en_20411066,Common Voice,Aogo received the Silbernes Lorbeerblatt; the highest sports award of Germany.,0,,
common_voice_en_17450569,Common Voice,The bit between the two car parks?,0,,
common_voice_en_77960,Common Voice,Maybe these desert birds could explain to him the meaning of love without ownership.,0,,
common_voice_en_513045,Common Voice,To measure the performance accurately we need a benchmark.,0,,
common_voice_en_18128226,Common Voice,Edgar is a geek.,0,,
common_voice_en_17869198,Common Voice,"Penny wise, pound foolish.",1,,
common_voice_en_526751,Common Voice,I won't give your niece a lollipop if she gets naughty again.,0,,
common_voice_en_19499548,Common Voice,"Clan, tournament and ladder lobbies are also integrated for some games.",0,,
common_voice_en_79809,Common Voice,I don't want to kill anybody.,0,,
common_voice_en_20757482,Common Voice,"We also knew damn well, if he went to Syria, he'd be tortured.",0,,
common_voice_en_18869386,Common Voice,"Several variations of the original were produced, some by Contactos, some by cloners.",0,,
common_voice_en_19252387,Common Voice,It's calculated that about half the caviar production comes from Sevruga.,0,,
common_voice_en_17941335,Common Voice,What is it you wish to know?,0,,
common_voice_en_17290263,Common Voice,"If you lie down with dogs, you'll get up with fleas.",0,,
common_voice_en_20590624,Common Voice,He's the worst kind of human being I know.,1,,
common_voice_en_10399660,Common Voice,The smell of burned rags itches my nose.,0,,
common_voice_en_204619,Common Voice,Hundreds of yelling people are swarming into the park like locusts!,1,,
common_voice_en_19056803,Common Voice,Ali told Asma to settle the quarrel.,0,,
common_voice_en_23639662,Common Voice,Reviews in the black press were generally favorable.,0,,
common_voice_en_204945,Common Voice,He had to spit some tobacco out of his mouth.,0,,
common_voice_en_20276082,Common Voice,"He was laid to rest in Oakland Cemetery, beside his wife.",0,,
common_voice_en_17277056,Common Voice,"Security, kick this guy out!",1,,
common_voice_en_21248941,Common Voice,You Damn Kid!,1,,
common_voice_en_573134,Common Voice,But in his heart he knew that it did matter.,0,,
common_voice_en_18253276,Common Voice,The reflection on the ice was distorted.,0,,
common_voice_en_17422934,Common Voice,"Nora finds herself ugly, because she has pimples.",0,,
common_voice_en_629473,Common Voice,I'll kill both of them!,1,,
common_voice_en_16183596,Common Voice,"You canÔÇÖt do that, it is written in our contract.",0,,
common_voice_en_18975223,Common Voice,"Pray tell us, are you nuts?",1,,
common_voice_en_18707215,Common Voice,"""Blood Follows"" details the story of three characters previously introduced in ""Memories of Ice"".",0,,
common_voice_en_17445479,Common Voice,Stark naked. Under bare poles. In puris naturalibus.,0,,
common_voice_en_605355,Common Voice,Are you a hypnotist?,0,,
common_voice_en_99833,Common Voice,Are you a hypnotist?,0,,
common_voice_en_451085,Common Voice,The everlasting Jew the wandering Jew,0,,
common_voice_en_19699173,Common Voice,The date on which Ward finally cut up the remains is unclear.,0,,
common_voice_en_17270879,Common Voice,"Jeez, you look stoned!",1,,
common_voice_en_59797,Common Voice,The weather in Finland sucks.,1,,
common_voice_en_22716612,Common Voice,He received the statuette from King Bhumibol himself.,0,,
common_voice_en_573119,Common Voice,I'm going to tell your mother on you.,0,,
common_voice_en_188041,Common Voice,What good is money to you if you're going to die?,0,,
common_voice_en_17260444,Common Voice,"I like the avenger of the new episode, he really is a badass.",0,,
common_voice_en_19747299,Common Voice,"For instance, Wicked Wisdom is a ""side project"" of actress Jada Pinkett Smith.",0,,
common_voice_en_17329375,Common Voice,"She outed herself as lesbian last year, didn't you hear?",0,,
common_voice_en_619274,Common Voice,"They blow across the world without a birthplace, and with no place to die.",0,,
common_voice_en_17263819,Common Voice,"Darling, we've run out of avocados!",0,,
common_voice_en_21671783,Common Voice,Atlantic history studies the Atlantic World in the early modern period.,0,,
common_voice_en_28095,Common Voice,Take your paws off me!,1,,
common_voice_en_19068911,Common Voice,"The apex is the first-formed, and therefore the oldest, part of the shell.",0,,
common_voice_en_20205317,Common Voice,A high proportion of the population commutes daily to London.,0,,
common_voice_en_17957953,Common Voice,Strip down the rig until you know exactly where the error is located.,0,,
common_voice_en_19110118,Common Voice,"He was athletic as a child, playing both football and cricket.",0,,
common_voice_en_20103740,Common Voice,"Philips Lighting has a Color Kinetics office in Burlington, Massachusetts.",0,,
common_voice_en_22275733,Common Voice,His titular dream contrasts his own time with the grandeur of King Arthur's period.,0,,
common_voice_en_17956886,Common Voice,"I saw Louis the other day, he was super concerned about you.",0,,
common_voice_en_18507492,Common Voice,Crash and burn.,0,,
common_voice_en_19749601,Common Voice,"A backbeat is a syncopated accentuation on the ""off"" beat.",0,,
common_voice_en_20875126,Common Voice,"Get out, or I'll call a policeman.",1,,
common_voice_en_19388956,Common Voice,"According to Rooney, the final draft gradually became a variation of ""Romeo and Juliet"".",0,,
common_voice_en_24116,Common Voice,"Look, the seam is now broken, it couldn't stand the jerk.",0,,
common_voice_en_520609,Common Voice,"Then suddenly, they kneel and die.",0,,
common_voice_en_2586278,Common Voice,Your behavior is embarrassing; go learn the art of social intercourse!,1,,
common_voice_en_12081267,Common Voice,Your behavior is embarrassing; go learn the art of social intercourse!,1,,
common_voice_en_18354499,Common Voice,There was something pathetic in the girl's attitude now.,1,,
common_voice_en_17808305,Common Voice,Why can't I skip this damn intro?,1,,
common_voice_en_522361,Common Voice,We just lost our heads and acted like a mob.,0,,
common_voice_en_276769,Common Voice,Heave the line over the port side.,0,,
common_voice_en_2722882,Common Voice,That insane android continues to ignore me.,1,,
common_voice_en_19725208,Common Voice,Loss of or decreased response to sexual stimuli and ejaculatory anhedonia are also possible.,0,,
common_voice_en_17276673,Common Voice,What idiot wrote this total drivel?,1,,
common_voice_en_17259130,Common Voice,"What do you expect from a pig, but a grunt?",0,,
common_voice_en_18300089,Common Voice,The dictator was radical in his ideology.,0,,
common_voice_en_571576,Common Voice,Somebody's going to get hurt!,0,,
common_voice_en_555593,Common Voice,Elsa knitted furiously.,0,,
common_voice_en_17897887,Common Voice,What was she to do?,0,,
common_voice_en_17914793,Common Voice,"Television can make you dumb, but it can also be good education.",0,,
common_voice_en_20305859,Common Voice,Men from Hirta would stay for a few days while gathering wool.,0,,
common_voice_en_21227,Common Voice,Typical American that can keep his mouth shut.,1,,
common_voice_en_17388050,Common Voice,"The more you stir, the more it stinks.",0,,
common_voice_en_706921,Common Voice,A plea for funds seems to come again.,0,,
common_voice_en_207288,Common Voice,Why can't I skip this damn intro?,1,,
common_voice_en_23786439,Common Voice,The French lost no ships and eventually hauled off.,0,,
common_voice_en_556507,Common Voice,I forgot to thank you for those roses.,0,,
common_voice_en_589687,Common Voice,I don't want to kill anybody.,0,,
common_voice_en_698301,Common Voice,Then get out of here.,0,,
common_voice_en_18074522,Common Voice,The everlasting Jew the wandering Jew.,0,,
common_voice_en_22277883,Common Voice,"However, should two marks be allowed on the ruler, the problem becomes solvable.",0,,
common_voice_en_15734852,Common Voice,My children are all scoundrels.,1,,
common_voice_en_560691,Common Voice,I think you're crazy.,1,,
common_voice_en_480749,Common Voice,Her low self-esteem is pathetic.,1,,
common_voice_en_17798819,Common Voice,Her purse was full of useless trash.,1,,
common_voice_en_18908170,Common Voice,"An advocate of abstinence and moral virtue, he was a teetotaler.",0,,
common_voice_en_204071,Common Voice,You could save that poor devil's life.,1,,
common_voice_en_18713959,Common Voice,"The word means ""takes the fat,"" or ""greedy person.",0,,
common_voice_en_17908219,Common Voice,A main application of pseudorandom generators lies in the de-randomization of computation that relies on randomness.,0,,
common_voice_en_614944,Common Voice,Put down that chair!,0,,
common_voice_en_165557,Common Voice,I would have won the Junior Olympics if not for those medaling kids.,0,,
common_voice_en_19584293,Common Voice,The rocker cover was invented to keep the oil in and the dirt out.,0,,
common_voice_en_18667512,Common Voice,I'm going to call it a day.,0,,
common_voice_en_126671,Common Voice,Shame on you and get off my front porch!,0,,
common_voice_en_164757,Common Voice,"Bacon, pancakes and maple syrup is a hearty start to any day.",0,,
common_voice_en_522287,Common Voice,I often wish you weren't such a stinker.,1,,
common_voice_en_20806014,Common Voice,"However, Apries' reign was also fraught with internal problems.",0,,
common_voice_en_593370,Common Voice,I had a memo from Art today.,0,,
common_voice_en_18101459,Common Voice,Her purse was full of useless trash.,1,,
common_voice_en_17844387,Common Voice,The cat knows well whose lips she licks.,0,,
common_voice_en_19615455,Common Voice,A symbol clearly denotes such drugs in their entry.,0,,
common_voice_en_117611,Common Voice,"The two men exchanged some words in Arabic, and the bar owner seemed irritated.",0,,
common_voice_en_17333326,Common Voice,"The grim reaper is waiting for you, reckless driver!",1,,
common_voice_en_21740383,Common Voice,The spot is marked by a plaque erected by the Township of Scarborough.,0,,
common_voice_en_19468099,Common Voice,He was succeeded by Noam Pikelny.,0,,
common_voice_en_564667,Common Voice,Her niece is a diabetic.,0,,
common_voice_en_18767795,Common Voice,"Tornadoes hit Fiskville, powerful enough to upend cars, and Melton.",0,,
common_voice_en_22361668,Common Voice,"This is ""my"" damn gym!"".",0,,
common_voice_en_17258341,Common Voice,"Never advertise razors by shaving a monkey, it's cruel and results in lawsuits.",0,,
common_voice_en_534136,Common Voice,"""Not to worry,"" said the alchemist.",0,,
common_voice_en_18135382,Common Voice,"Security, kick this guy out!",1,,
common_voice_en_18971338,Common Voice,The amount of deviation is called the slope of the grain.,0,,
common_voice_en_8975,Common Voice,Several men are standing next to a large animal while a woman walks by.,0,,
common_voice_en_23736250,Common Voice,The school also holds an annual auction fundraiser.,0,,
common_voice_en_123790,Common Voice,Pigs are cute and intelligent animals.,0,,
common_voice_en_616427,Common Voice,The boy listened quietly.,0,,
common_voice_en_199832,Common Voice,We're a different world.,0,,
common_voice_en_17776578,Common Voice,"When she called her friend for help with her computer, she repeatedly emphasized, that she hadn't done anything.",0,,
common_voice_en_17393464,Common Voice,What idiot wrote this total drivel?,1,,
common_voice_en_92128,Common Voice,With that new haircut you look ridiculous.,1,,
common_voice_en_18392,Common Voice,I'm going to become bitter and distrustful of people because one person betrayed me.,0,,
common_voice_en_23860656,Common Voice,It was in Sturminster Newton Hundred and the tenant-in-chief was Glastonbury Abbey.,0,,
common_voice_en_489688,Common Voice,Get your guns out.,0,,
common_voice_en_108383,Common Voice,Maybe he really is a fool.,1,,
common_voice_en_638295,Common Voice,I'll kill both of them!,1,,
common_voice_en_17258233,Common Voice,"Anita passed out during gymnastics, she recovered quickly.",0,,
common_voice_en_642986,Common Voice,"""You're the one who may die,"" the alchemist said.",0,,
common_voice_en_21335774,Common Voice,"He was taken in by one of the Chinese immigrants, Chen Yijiu.",0,,
common_voice_en_20877775,Common Voice,"I keep arranging until the cows come home, which is sometimes a weakness.",0,,
common_voice_en_17813039,Common Voice,What idiot wrote this total drivel?,1,,
common_voice_en_18693495,Common Voice,"As soon as you take your first puff, you are an enemy of society.",0,,
common_voice_en_19475245,Common Voice,A constant current input will therefore produce a linearly increasing output.,0,,
common_voice_en_37224,Common Voice,Hundreds of yelling people are swarming into the park like locusts!,1,,
common_voice_en_648250,Common Voice,Those gangsters get what they deserve.,0,,
common_voice_en_20453371,Common Voice,"Taishanese originates from the Taishan region, where it is spoken.",0,,
common_voice_en_18134058,Common Voice,Every cock crows loud on his own dunghill.,0,,
common_voice_en_20975532,Common Voice,"Traditionally, she is seen in Neapolitan peasant clothing.",0,,
common_voice_en_18467727,Common Voice,His clothes are really outrageous. He's a one-off,1,,
common_voice_en_23384405,Common Voice,The towers within Park Island have been placed with parks and landscaped gardens.,0,,
common_voice_en_17255781,Common Voice,"The grim reaper is waiting for you, reckless driver!",1,,
common_voice_en_88102,Common Voice,It would kill you.,0,,
common_voice_en_19018839,Common Voice,The cursor can also record an intermediate result on any of the scales.,0,,
common_voice_en_502837,Common Voice,You're losing your eye.,0,,
common_voice_en_22732104,Common Voice,"By morning, Kham goes on his way.",0,,
common_voice_en_620778,Common Voice,You're worth more dead than alive.,1,,
common_voice_en_20974978,Common Voice,Wesley informs Angel that a Boretz demon is loose and killing people.,0,,
common_voice_en_19245019,Common Voice,"I clean lost my temper, the fools!",1,,
common_voice_en_17343881,Common Voice,To be the cock in the basket to be cock of the company.,0,,
common_voice_en_526058,Common Voice,I think you're crazy.,1,,
common_voice_en_158063,Common Voice,She's a feisty little ferret.,0,,
common_voice_en_17869129,Common Voice,A fool and his money are soon parted.,0,,
common_voice_en_17475945,Common Voice,"The grim reaper is waiting for you, reckless driver!",1,,
common_voice_en_516495,Common Voice,"Then suddenly, they kneel and die.",0,,
common_voice_en_584952,Common Voice,You've got the brain of a pancake.,1,,
common_voice_en_18314079,Common Voice,Slice the aubergine.,0,,
common_voice_en_23929901,Common Voice,The other is epithelial in appearance.,0,,
common_voice_en_191359,Common Voice,The boy was suddenly happy to be there at the warehouse.,0,,
common_voice_en_22440056,Common Voice,The area of present-day Tomioka was part of Mutsu Province.,0,,
common_voice_en_35257,Common Voice,Some of our biggest clients are affected.,0,,
common_voice_en_20416866,Common Voice,"His ""A Discourse of Trade"", written five years later, was much more significant, however.",0,,
common_voice_en_171327,Common Voice,"The stranger withdrew the sword from the boy's forehead, and the boy felt immensely relieved.",0,,
common_voice_en_51568,Common Voice,What good is money to you if you're going to die?,0,,
common_voice_en_17264171,Common Voice,"James Watt didn't invent the steam engine, but he improved it significantly.",0,,
common_voice_en_652821,Common Voice,What idiot wrote this total drivel?,1,,
common_voice_en_527329,Common Voice,You are so rude!,1,,
common_voice_en_17749276,Common Voice,Leaves turn brown and yellow in the fall.,0,,
common_voice_en_17391016,Common Voice,"Jennifer's expression changed. ""Pull my finger"", she said.",0,,
common_voice_en_17279002,Common Voice,"""You're a good lad, you know?"" he told his son with stern eyes.",0,,
common_voice_en_23361216,Common Voice,"At one time or another, it influenced most of the Asian continent.",0,,
common_voice_en_19755114,Common Voice,Examples range from the academic to sporting and more frivolous events.,0,,
common_voice_en_104310,Common Voice,I think you're crazy.,1,,
common_voice_en_153646,Common Voice,Those gangsters get what they deserve.,0,,
common_voice_en_189008,Common Voice,That can't be true.,0,,
common_voice_en_19533065,Common Voice,Her parents separated when she was a baby.,0,,
common_voice_en_17266702,Common Voice,Will you come with me?,0,,
common_voice_en_664529,Common Voice,You get out of here quick.,0,,
common_voice_en_649428,Common Voice,It would kill you.,0,,
common_voice_en_479676,Common Voice,Don't hurt my finger again.,0,,
common_voice_en_21834507,Common Voice,The film was so popular that it was given a theatrical release.,0,,
common_voice_en_24011167,Common Voice,Bush for President campaign.,0,,
common_voice_en_17904824,Common Voice,Who told you that?,0,,
common_voice_en_16048298,Common Voice,"Alice, who the fuck is Bob?",1,,
common_voice_en_23704855,Common Voice,"It is located in Hammerseley Barracks and Fox Lines, Aldershot, Hampshire, England.",0,,
common_voice_en_17696597,Common Voice,"Don't you dare switch away, I think rhymes are okay, since they never decay, I could do this all day.",0,,
common_voice_en_145765,Common Voice,He had to spit some tobacco out of his mouth.,0,,
common_voice_en_186736,Common Voice,So you can kill me too?,0,,
common_voice_en_17451178,Common Voice,"The grim reaper is waiting for you, reckless driver!",1,,
common_voice_en_505732,Common Voice,Kid playing near water fountain,0,,
common_voice_en_506677,Common Voice,You ought to stay over.,0,,
common_voice_en_17776073,Common Voice,When will the train arrive this morning?,0,,
common_voice_en_19568419,Common Voice,The district is currently represented by Democrat Kathy Castor.,0,,
common_voice_en_18978070,Common Voice,"The ""Freya"" radar was more advanced than its British counterpart, Chain Home.",0,,
common_voice_en_110445,Common Voice,"""It's going to take a while,"" the boy said.",0,,
common_voice_en_19180447,Common Voice,He's supposed to be ugly.,0,,
common_voice_en_567197,Common Voice,Then he turned to the boy.,0,,
common_voice_en_17758816,Common Voice,He crawled with care along the ledge.,0,,
common_voice_en_18162929,Common Voice,She sewed the torn coat quite neatly.,0,,
common_voice_en_163491,Common Voice,Adam is a crook.,1,,
common_voice_en_20782695,Common Voice,"Mayall's character is devious, low-minded, calculating and stupid; Edmondson's merely very stupid.",1,,
common_voice_en_17254284,Common Voice,"Before you get too excited, keep in mind that it only applies to low-dimensional problems.",0,,
common_voice_en_18930868,Common Voice,Both were written by Craig Wessel.,0,,
common_voice_en_20267501,Common Voice,The ubiquitous brown bear was present as well.,0,,
common_voice_en_18810698,Common Voice,The term can take on specific conventional meanings in the grammars of particular languages.,0,,
common_voice_en_18792355,Common Voice,Nose Railway is a wholly owned subsidiary of Hankyu Corporation.,0,,
common_voice_en_17259734,Common Voice,Did you see it?,0,,
common_voice_en_99259,Common Voice,"""You're the one who may die,"" the alchemist said.",0,,
common_voice_en_486382,Common Voice,A woman in white is doing acrobatics.,0,,
common_voice_en_23892801,Common Voice,West Thessalian and Boeotian had come under a strong Northwest Greek influence.,0,,
common_voice_en_103721,Common Voice,He was immensely excited at the news.,0,,
common_voice_en_18779599,Common Voice,Stevens continued his solid form by reaching the quarter-finals at the Welsh Open.,0,,
common_voice_en_122066,Common Voice,You could save that poor devil's life.,1,,
common_voice_en_23380221,Common Voice,The ornithological section was mainly written by Alfred Moquin-Tandon.,0,,
common_voice_en_25953,Common Voice,Let them come in.,0,,
common_voice_en_253774,Common Voice,Thieves who rob friends deserve jail.,0,,
common_voice_en_18825649,Common Voice,"Since receiving the grant, the magazine has increased its budget.",0,,
common_voice_en_17428953,Common Voice,"Those women are all card sharks, don't be fooled.",1,,
common_voice_en_19281353,Common Voice,Carmi is a biblical name.,0,,
common_voice_en_215164,Common Voice,"""Lots of places sell tea around here,"" the merchant said.",0,,
common_voice_en_547455,Common Voice,Don't be a pessimist!,1,,
common_voice_en_17260420,Common Voice,"Alice, who the fuck is Bob?",1,,
common_voice_en_21670499,Common Voice,A chapel associated with Edward the Confessor existed north of the church.,0,,
common_voice_en_17731334,Common Voice,"Our bitch had puppies, do you want one?",0,,
common_voice_en_556362,Common Voice,But I didnÔÇÖt think that it contained any living creature.,0,,
common_voice_en_17799198,Common Voice,Don't try to teach your grand-mother to suck eggs.,0,,
common_voice_en_18111634,Common Voice,Cut off one's nose to spite one's face.,0,,
common_voice_en_488109,Common Voice,You wouldn't want to kill anybody.,0,,
common_voice_en_23819635,Common Voice,"Later, it was discovered that Kallikak had an affair with a ""nameless feeble-minded woman"".",1,,
common_voice_en_529304,Common Voice,Long live the Emperor,0,,
common_voice_en_17403095,Common Voice,"Penny wise, pound foolish.",1,,
common_voice_en_86174,Common Voice,There were monkeys all over the temple.,0,,
common_voice_en_167511,Common Voice,I'd better hustle him up!,0,,
common_voice_en_22960418,Common Voice,Removal of the testicles alone is termed castration.,0,,
common_voice_en_20791681,Common Voice,"The most common treatment is blood transfusions, especially in infants and young children.",0,,
common_voice_en_21701729,Common Voice,That's what he told me.,0,,
common_voice_en_24063543,Common Voice,The Ottomans also agreed to the abolition of all monopolies.,0,,
common_voice_en_18145039,Common Voice,It's wicked how Lara neglects her pussy cat.,0,,
common_voice_en_22047670,Common Voice,Detecon is a division of Deutsche Telekom.,0,,
common_voice_en_17673776,Common Voice,"The more you stir, the more it stinks.",0,,
common_voice_en_21370914,Common Voice,He traveled frequently and served as a spiritual consultant.,0,,
common_voice_en_209763,Common Voice,It's easy for you to talk.,0,,
common_voice_en_19635677,Common Voice,The Ethics Committee never reported or commented on any investigation of Deal.,0,,
common_voice_en_18230677,Common Voice,What a bummer!,0,,
common_voice_en_484491,Common Voice,He's nuts about you.,0,,
common_voice_en_461719,Common Voice,One of these days is none of these days.,0,,
common_voice_en_21130602,Common Voice,The complex is operated by the state of New York.,0,,
common_voice_en_19827500,Common Voice,"It was named for Elwood Thomas, a homesteader.",0,,
common_voice_en_23685712,Common Voice,Here's the key in the letter.,0,,
common_voice_en_690347,Common Voice,An elephant on the roof is soon an elephant in the house.,0,,
common_voice_en_551379,Common Voice,Then get out of here.,0,,
common_voice_en_23375878,Common Voice,Kinderhook Creek passes through the southeast part of the town.,0,,
common_voice_en_18488359,Common Voice,"Because, boys and ladies and gentlemen, he is a pessimist.",1,,
common_voice_en_17253518,Common Voice,Do you think your boyfriend is cheating on you?,0,,
common_voice_en_659890,Common Voice,One of the world's biggest problems is the growth of human population.,0,,
common_voice_en_19707347,Common Voice,"ÔÇÿSo much humour,ÔÇÖ said Sam.",0,,
common_voice_en_567187,Common Voice,He took out his money and counted it.,0,,
common_voice_en_70473,Common Voice,A half a heelot!,1,,
common_voice_en_82627,Common Voice,Don't hurt my finger again.,0,,
common_voice_en_23848187,Common Voice,How far can freedom of the press be extended in wartime?,0,,
common_voice_en_17957357,Common Voice,It is in front of his house.,0,,
common_voice_en_253674,Common Voice,The dragon breathed a stream of fire thirty feet long.,0,,
common_voice_en_17897254,Common Voice,An act of faith.,0,,
common_voice_en_689041,Common Voice,A lot of money.,0,,
common_voice_en_480032,Common Voice,"Our bitch had puppies, do you want one?",0,,
common_voice_en_478013,Common Voice,Because he's wearing moccasins.,0,,
common_voice_en_19707283,Common Voice,There was no room for a fat little rabbit to squeeze underneath.,0,,
common_voice_en_15735375,Common Voice,Her jeans have holes in them.,0,,
common_voice_en_22978498,Common Voice,Four black soldiers were killed.,0,,
common_voice_en_17314302,Common Voice,"By accepting our privacy policy, you agree that we save your data for twenty-one days to detect frauds.",0,,
common_voice_en_540113,Common Voice,Beggars can't be choosers.,0,,
common_voice_en_18573433,Common Voice,I am writing to you in relation to the job advertised.,0,,
common_voice_en_17254328,Common Voice,"By accepting our privacy policy, you agree that we save your data for twenty-one days to detect frauds.",0,,
common_voice_en_18071519,Common Voice,Can you imagine something more beautiful than a plastic bag swooping and floating in a breeze?,0,,
common_voice_en_493594,Common Voice,But the merchant understood what the boy had said.,0,,
common_voice_en_392760,Common Voice,Monkeys smile when they are scared.,0,,
common_voice_en_23366147,Common Voice,"The insects suck the sap of the tree and excrete ""sticklac"" almost constantly.",0,,
common_voice_en_17529221,Common Voice,"Those women are all card sharks, don't be fooled.",1,,
common_voice_en_144660,Common Voice,WhatÔÇÖs to be done?,0,,
common_voice_en_19572967,Common Voice,"Two days later, Dickau signed with the Clippers.",0,,
common_voice_en_23335733,Common Voice,Lots of blood.,0,,
