FileName,Dataset,text,label2a,Starting,Ending
common_voice_en_674214,Common Voice,"Those women are all card sharks, don't be fooled.",1,,
common_voice_en_165669,Common Voice,Don't you remember the home I promised you?,0,,
common_voice_en_18667081,Common Voice,The absence of the car helped me to make it.,0,,
common_voice_en_17345314,Common Voice,"Well, what do you want?",0,,
common_voice_en_181462,Common Voice,But now the sounds inside had stopped.,0,,
common_voice_en_19497636,Common Voice,He is also a spokesman for Vemma vitamin supplements.,0,,
common_voice_en_59511,Common Voice,Think about what you would like to improve in your custom version.,0,,
common_voice_en_22250520,Common Voice,It has since been updated and expanded a number of times.,0,,
common_voice_en_172146,Common Voice,Your behavior is embarrassing; go learn the art of social intercourse!,1,,
common_voice_en_17269950,Common Voice,Is he a drunkard or what?,1,,
common_voice_en_23356190,Common Voice,Today it is a subsidiary of electronics corporation Philips.,0,,
common_voice_en_17835160,Common Voice,Never look a gift horse in the mouth.,0,,
common_voice_en_20302370,Common Voice,Its guests included General George C. Marshall and theater director Alvina Krause.,0,,
common_voice_en_61794,Common Voice,I'm through listening to you!,0,,
common_voice_en_32217,Common Voice,"This beer has been brewed in Germany, more specifically in Bavaria.",0,,
common_voice_en_507265,Common Voice,"Then suddenly, they kneel and die.",0,,
common_voice_en_20455771,Common Voice,Kashani then became closer to the National Front.,0,,
common_voice_en_674668,Common Voice,That damn mouse could sense my anger.,0,,
common_voice_en_670151,Common Voice,Many telescopes were pointed at it.,0,,
common_voice_en_17887425,Common Voice,The toad spit a caustic slime at the bees.,0,,
common_voice_en_94127,Common Voice,You're losing your eye.,0,,
common_voice_en_23948067,Common Voice,He has now given up cricket to become a chartered accountant.,0,,
common_voice_en_17956822,Common Voice,The play seems dull and quite stupid.,1,,
common_voice_en_18134041,Common Voice,Scientists believe the Solar System formed around four point six billion years ago.,0,,
common_voice_en_17808730,Common Voice,Beasts get fat by change of pastures.,0,,
common_voice_en_20580277,Common Voice,It doesn't mean somebody is going to kill you.,0,,
common_voice_en_18474111,Common Voice,"If you compare yourself with others, you may become vain or bitter",0,,
common_voice_en_17787409,Common Voice,The baby puts his right foot in his mouth.,0,,
common_voice_en_618455,Common Voice,He decided to stay right there and await his return.,0,,
common_voice_en_484537,Common Voice,You wouldn't want to kill anybody.,0,,
common_voice_en_18666412,Common Voice,"""I will go down and open the gate,"" he whispered.",0,,
common_voice_en_17763489,Common Voice,I want to go on.,0,,
common_voice_en_20957750,Common Voice,"McKeever also wrote a new story for ""The Waiting Place"" illustrated by Mike Norton.",0,,
common_voice_en_19281146,Common Voice,"Gulnara leaves, saying that she will kill Seid.",0,,
common_voice_en_180977,Common Voice,A half a heelot!,1,,
common_voice_en_17147898,Common Voice,Beggars can't be choosers.,0,,
common_voice_en_606248,Common Voice,Put down that chair!,0,,
common_voice_en_18162084,Common Voice,The sky in the west is tinged with orange red.,0,,
common_voice_en_17256641,Common Voice,"Jeez, you look stoned!",1,,
common_voice_en_18487797,Common Voice,Oh No! I dropped my wallet!,0,,
common_voice_en_642407,Common Voice,What's she doing over here?,0,,
common_voice_en_18520645,Common Voice,You used to joyride like the very devil.,1,,
common_voice_en_15707,Common Voice,One of the worst crooks in town!,0,,
common_voice_en_22264062,Common Voice,The main guns were controlled from the conning tower.,0,,
common_voice_en_18420615,Common Voice,"In fact, you will be killing two birds with one stone, sir.",0,,
common_voice_en_21093364,Common Voice,He chose to come out on the one-year anniversary of his father's death.,0,,
common_voice_en_1614246,Common Voice,"Yours sincerely, Satan.",0,,
common_voice_en_19142013,Common Voice,"The ruins of the Tung Chung Battery, also a historical monument, are located nearby.",0,,
common_voice_en_21946102,Common Voice,eight,0,,
common_voice_en_177043,Common Voice,But don't let that out of your sight.,0,,
common_voice_en_18460364,Common Voice,Who baked those muffins?,0,,
common_voice_en_606322,Common Voice,You killed all three of them for nothing.,0,,
common_voice_en_22756750,Common Voice,"He has previously played top-flight football in Paraguay, Italy, Argentina, England and Spain.",0,,
common_voice_en_20326387,Common Voice,Virginia's descendants continue her legacy.,0,,
common_voice_en_17849958,Common Voice,Don't try to teach your grand-mother to suck eggs.,0,,
common_voice_en_547615,Common Voice,One of us is going to jail!,0,,
common_voice_en_18909335,Common Voice,"Later the name was changed from ""Convention"" to ""Association"".",0,,
common_voice_en_20805069,Common Voice,Cranial hair prostheses have advanced due to technology.,0,,
common_voice_en_681552,Common Voice,I would have won the Junior Olympics if not for those medaling kids.,0,,
common_voice_en_19285,Common Voice,"Remember to take your full course of antibiotics, stopping early is dangerous for your health.",0,,
common_voice_en_46457,Common Voice,A half a heelot!,1,,
common_voice_en_21128247,Common Voice,The Muslims would cease warfare and not hurt any of the Jews.,0,,
common_voice_en_531995,Common Voice,Shame on you and get off my front porch!,0,,
common_voice_en_18418363,Common Voice,The legal action comprised a claim and counterclaim.,0,,
common_voice_en_22580,Common Voice,"""My name is Melchizedek,"" said the old man.",0,,
common_voice_en_583110,Common Voice,What idiot wrote this total drivel?,1,,
common_voice_en_23677413,Common Voice,"Ayllu solidarity is a combination of kinship and territorial ties, as well as symbolism.",0,,
common_voice_en_154703,Common Voice,A lot of money.,0,,
common_voice_en_19298075,Common Voice,"Ireland also had seven ""manor boroughs"", in which only freeholders voted.",0,,
common_voice_en_30547,Common Voice,Salim moved from India to the Netherlands.,0,,
common_voice_en_18891931,Common Voice,"Alston commented that he felt the cartoonist ""might have had some racial intent"".",0,,
common_voice_en_17675711,Common Voice,"Penny wise, pound foolish.",1,,
common_voice_en_18604641,Common Voice,"Go away, you crazy loon!",1,,
common_voice_en_18649727,Common Voice,"Damn it, they'd rush the platform.",0,,
common_voice_en_23233044,Common Voice,Similar demonstrations were also done in other cities of Angola.,0,,
common_voice_en_18633960,Common Voice,Oh No! I dropped my wallet!.,0,,
common_voice_en_20328900,Common Voice,It is so bad for your poor eyes.,0,,
common_voice_en_20931173,Common Voice,Black women have twice the risk for sex cord-stromal tumors compared to non-Black women.,0,,
common_voice_en_203826,Common Voice,Never look a gift horse in the mouth.,0,,
common_voice_en_617255,Common Voice,She's a feisty little ferret.,0,,
common_voice_en_115582,Common Voice,"Before him was an enormous white horse, rearing over him with a frightening scream.",0,,
common_voice_en_158148,Common Voice,I hope nobody finds out we've been here.,0,,
common_voice_en_21926279,Common Voice,However the locals were able to save the post office.,0,,
common_voice_en_17263709,Common Voice,Is he a drunkard or what?,1,,
common_voice_en_18901734,Common Voice,Greyson is openly gay.,0,,
common_voice_en_24841,Common Voice,How are you doing?,0,,
common_voice_en_18314227,Common Voice,The very opposite is true; they are discouraged vagabonds.,0,,
common_voice_en_680651,Common Voice,I often wish you weren't such a stinker.,1,,
common_voice_en_21687686,Common Voice,There are also no Linux drivers available.,0,,
common_voice_en_18708668,Common Voice,The only Vauxhall badging was on the hub caps and steering wheel.,0,,
common_voice_en_10737857,Common Voice,Pure bred poodles have curls.,0,,
common_voice_en_21329160,Common Voice,"He grew up in a local suburb, Mission Hills, Kansas.",0,,
common_voice_en_25628,Common Voice,You've got the brain of a pancake.,1,,
common_voice_en_639009,Common Voice,I often wish you weren't such a stinker.,1,,
common_voice_en_480031,Common Voice,Those people are kick-ass samba dancers!,0,,
common_voice_en_40760,Common Voice,You get somebody else to wash the diapers.,0,,
common_voice_en_28103,Common Voice,Adam is a crook.,1,,
common_voice_en_148469,Common Voice,Out of the mouths of babes.,0,,
common_voice_en_508943,Common Voice,Don't be a fool.,0,,
common_voice_en_23843762,Common Voice,Many of them are referred to as squares or parks.,0,,
common_voice_en_135415,Common Voice,You've got the brain of a pancake.,1,,
common_voice_en_119462,Common Voice,Typical American that can keep his mouth shut.,1,,
common_voice_en_17362318,Common Voice,"""What a load of trash"", Sarah opined.",1,,
common_voice_en_21261631,Common Voice,His subjects obey him with perfect submission.,0,,
common_voice_en_19972813,Common Voice,"He comes face to face with Pluto, who attacks him.",0,,
common_voice_en_22371965,Common Voice,The existence of the Kordylewski clouds is still under dispute.,0,,
common_voice_en_17412100,Common Voice,"""What a load of trash"", Sarah opined.",1,,
common_voice_en_20057332,Common Voice,These parties rose to prominence only to be banned by Turkey's secular authorities.,0,,
common_voice_en_19758332,Common Voice,Soft serve ice cream is served topped with sprinkles for a slight extra charge.,0,,
common_voice_en_20777210,Common Voice,Sharkey County is located in the Mississippi Delta region.,0,,
common_voice_en_18403087,Common Voice,How many more iterations are we going to need?,0,,
common_voice_en_524188,Common Voice,Take your paws off me!,1,,
common_voice_en_17969743,Common Voice,Screen the porch with woven straw mats.,0,,
common_voice_en_19764316,Common Voice,"Since ""Battle Royale"", Takami has not released any work.",0,,
common_voice_en_10444,Common Voice,Experts of geology agree: Yesterday's tsunami was just a herald of the imminent apocalypse.,0,,
common_voice_en_19326080,Common Voice,"He is overbearing, sarcastic, and extremely vain, but good-hearted.",1,,
common_voice_en_18771641,Common Voice,His resume included performing with transsexuals and females with strap-ons.,0,,
common_voice_en_20240215,Common Voice,The earliest medieval settlement may have been on the higher ground around Wall.,0,,
common_voice_en_672446,Common Voice,I'll send you a box.,0,,
common_voice_en_23713400,Common Voice,She ends the story by saying That is how you build a prison.,0,,
common_voice_en_17246800,Common Voice,"Those women are all card sharks, don't be fooled.",1,,
common_voice_en_18078396,Common Voice,"They're silly, their buckets are over there behind mine.",1,,
common_voice_en_18124765,Common Voice,How do you know it?,0,,
common_voice_en_18059835,Common Voice,Don't try to teach your grand-mother to suck eggs.,0,,
common_voice_en_200484,Common Voice,A fool and his money are soon parted.,0,,
common_voice_en_18404410,Common Voice,I love her passionately.,0,,
common_voice_en_23911686,Common Voice,She now wants revenge by killing all of the other girls Jake dates.,1,,
common_voice_en_685992,Common Voice,You get somebody else to wash the diapers.,0,,
common_voice_en_18139515,Common Voice,Watching the parody was great entertainment.,0,,
common_voice_en_19754474,Common Voice,"The school was first named The School for the Blind, Deaf and Dumb.",0,,
common_voice_en_23554615,Common Voice,Vegetation is abundant but of very limited variety.,0,,
common_voice_en_21080877,Common Voice,"He was the primary architect, with Senator Alan Simpson, of major immigration reform legislation.",0,,
common_voice_en_429644,Common Voice,He is a scoundrel.,1,,
common_voice_en_17249497,Common Voice,"Don't knock on death's door, ring the doorbell and run.",0,,
common_voice_en_489665,Common Voice,Don't you know that girl's very sick?,0,,
common_voice_en_18542588,Common Voice,I asked Mark to do the literature review.,0,,
common_voice_en_19967798,Common Voice,No one has done anything but walk away and die.,0,,
common_voice_en_18142505,Common Voice,You have to crawl before you walk.,0,,
common_voice_en_571110,Common Voice,Then you'll die in the midst of trying to realize your destiny.,0,,
common_voice_en_342425,Common Voice,He sent the boy on a short errand.,0,,
common_voice_en_57177,Common Voice,Don't be more catholic than the pope.,0,,
common_voice_en_639219,Common Voice,"Wrestling, boxing and karate are well-known examples for martial arts.",0,,
common_voice_en_201390,Common Voice,"They were both silent for a time, observing the plaza and the townspeople.",0,,
common_voice_en_21281738,Common Voice,"In this way, nurse sharks are able to suck in their prey.",0,,
common_voice_en_20856698,Common Voice,The book concludes with their departure from Beijing.,0,,
common_voice_en_622732,Common Voice,He's nuts about you.,0,,
common_voice_en_20248945,Common Voice,Control strategies can also be distributed among individual ramps.,0,,
common_voice_en_20113596,Common Voice,"However, Popeye hates spinach and refuses to eat it.",0,,
common_voice_en_18129628,Common Voice,There's a group of unruly teens bumming around in your garden.,1,,
common_voice_en_22302958,Common Voice,"This, like other attempts to gain city status, was defeated.",0,,
common_voice_en_18052428,Common Voice,You ain't gonna ruin this heist!,0,,
common_voice_en_21936843,Common Voice,"It was marked with the name ""Andre Micheaux"", Vaughn's real name.",0,,
common_voice_en_19657870,Common Voice,Both the tip and sample must be electrically conductive.,0,,
common_voice_en_657631,Common Voice,What good is money to you if you're going to die?,0,,
common_voice_en_82982,Common Voice,You wouldn't want to kill anybody.,0,,
common_voice_en_17260267,Common Voice,"Oh, I think you are right.",0,,
common_voice_en_17917307,Common Voice,An idle man is the devil's playfellow.,0,,
common_voice_en_23999716,Common Voice,The Carnage Crew also tried to beat respect into them.,0,,
common_voice_en_59869,Common Voice,"""That makes sense,"" the alchemist answered.",0,,
common_voice_en_21440329,Common Voice,The two latter creeks drain the Santa Rosa Plateau.,0,,
common_voice_en_642337,Common Voice,What good is money to you if you're going to die?,0,,
common_voice_en_20075159,Common Voice,"Prior to school unification, the Howard High School mascot was Pirates.",0,,
common_voice_en_19636964,Common Voice,Batu Caves is also the name of a nearby village.,0,,
common_voice_en_19761317,Common Voice,For a list of titles please see the version of this page.,0,,
common_voice_en_19350036,Common Voice,"The shop was recently demolished, to make way for housing.",0,,
common_voice_en_462972,Common Voice,Don't blow your own trumpet.,0,,
common_voice_en_17731312,Common Voice,A penny wise and a pound foolish.,1,,
common_voice_en_20907763,Common Voice,Viktoria leaves and Agnes' family eats the food made for the party.,0,,
common_voice_en_533797,Common Voice,I'll kill both of them!,1,,
common_voice_en_20475120,Common Voice,Many quiz leagues run individual competitions.,0,,
common_voice_en_681657,Common Voice,"The camel driver was not a fighter, and he had consulted with seers.",0,,
common_voice_en_547066,Common Voice,"When she tried to withdraw some money from her bank account, the ATM claimed her card was invalid.",0,,
common_voice_en_17249896,Common Voice,"Sentences are built of nouns, verbs and sometimes adjectives.",0,,
common_voice_en_17715676,Common Voice,"You're not psychotic, you just wish you were?",1,,
common_voice_en_627712,Common Voice,Then he turned to the boy.,0,,
common_voice_en_19843879,Common Voice,"These settlers grew peas, beans, sugar cane, and tomatoes.",0,,
common_voice_en_18430964,Common Voice,The words delicious and disgusting are antonyms.,0,,
common_voice_en_96155,Common Voice,He thought of all the married shepherds he had known.,0,,
common_voice_en_18501168,Common Voice,Don't you see I hate you.,1,,
common_voice_en_17280860,Common Voice,"Soon ripe, soon rot.",0,,
common_voice_en_170166,Common Voice,I'm going to tell your mother on you.,0,,
common_voice_en_23309864,Common Voice,She was later an Open University social studies tutor in Belfast for two years.,0,,
common_voice_en_47235,Common Voice,"Thanks to reverse port tunneling, I can expose this HTTP server running on Windows to my Linux machine.",0,,
common_voice_en_18850845,Common Voice,"Only two boats survived, the ""Victoria"" and the ""Brothers"".",0,,
common_voice_en_489371,Common Voice,A half a heelot!,1,,
common_voice_en_490915,Common Voice,I accuse this man of being a faker!,1,,
common_voice_en_18536994,Common Voice,"If you pay peanuts, you only get monkeys.",0,,
common_voice_en_2202819,Common Voice,"The grim reaper is waiting for you, reckless driver!",1,,
common_voice_en_559082,Common Voice,The everlasting Jew the wandering Jew,0,,
common_voice_en_17782190,Common Voice,A poor man is better than a liar.,0,,
common_voice_en_658025,Common Voice,You've got the brain of a pancake.,1,,
common_voice_en_23841274,Common Voice,The youth wing of the party is known as Communist Youth of Albania.,0,,
common_voice_en_19994637,Common Voice,The building has been lovingly preserved and is still used as a chapel.,0,,
common_voice_en_17403316,Common Voice,The grass curled around the fence post.,0,,
common_voice_en_18245394,Common Voice,As hard as nails.,0,,
common_voice_en_19877541,Common Voice,"Under Scottish legislation, banknotes are issued by commercial banks not the government.",0,,
common_voice_en_21432251,Common Voice,"Other descriptive names such as sonic metric are also sometimes used, interchangeably.",0,,
common_voice_en_17365183,Common Voice,"Have you finished with the Annual Report, Jane?",0,,
common_voice_en_23873864,Common Voice,"Fredenberg Township was named for Jacob Fredenberg, an early settler.",0,,
common_voice_en_20398541,Common Voice,"In meteorology, an asterism in a station model indicates moderate snowfall.",0,,
common_voice_en_18648857,Common Voice,"Yes, lie quietly and reflect, little fool!",1,,
common_voice_en_614048,Common Voice,That insane android continues to ignore me.,1,,
common_voice_en_621366,Common Voice,Couldn't want a better life and death.,0,,
common_voice_en_20177181,Common Voice,The town had two elementary schools and one junior high school.,0,,
common_voice_en_21868727,Common Voice,The scale of measures such as 'size' and 'access time' have changed dramatically.,0,,
common_voice_en_18101417,Common Voice,He is a scoundrel.,1,,
common_voice_en_108968,Common Voice,"""Somewhere you are holding the person I love,"" the boy said.",0,,
common_voice_en_17802066,Common Voice,ICBM is the abbreviation for intercontinental ballistic missile.,0,,
common_voice_en_20298359,Common Voice,An Etruscan garrison was detailed to hold it.,0,,
common_voice_en_19974171,Common Voice,Fifty were built.,0,,
common_voice_en_584779,Common Voice,Take me out of here!,0,,
common_voice_en_19626753,Common Voice,"Stoneleigh House, in High Street, was formerly the premises of parchment makers.",0,,
common_voice_en_17959349,Common Voice,Every cock crows loud on his own dunghill.,0,,
common_voice_en_20088992,Common Voice,Only an idiot would walk away from that.,0,,
common_voice_en_131191,Common Voice,I told you to have the ice box fixed.,0,,
common_voice_en_23798882,Common Voice,Burns faced a difficult re-election campaign.,0,,
common_voice_en_243894,Common Voice,Don't go off half-cocked.,0,,
common_voice_en_193827,Common Voice,"One afternoon, one of his servants fell ill, and it appeared that he would die.",0,,
common_voice_en_19706573,Common Voice,The homosexual explanation is one which we must not ignore.,0,,
common_voice_en_18498722,Common Voice,His rubbish was taken away in the dustcart,1,,
common_voice_en_18197931,Common Voice,The green light in the brown box flickered.,0,,
common_voice_en_210215,Common Voice,I'll kill both of them!,1,,
common_voice_en_28276,Common Voice,My lady could not express her disapproval.,0,,
common_voice_en_17412578,Common Voice,If you mumble your speech will be lost.,0,,
common_voice_en_17268852,Common Voice,"Those women are all card sharks, don't be fooled.",1,,
common_voice_en_18460426,Common Voice,I requested collection upon delivery.,0,,
common_voice_en_667796,Common Voice,Then get out of here.,0,,
common_voice_en_19646316,Common Voice,The little children are freezing to death.,0,,
common_voice_en_649682,Common Voice,Hundreds of yelling people are swarming into the park like locusts!,1,,
common_voice_en_20293996,Common Voice,You can form a band.,0,,
common_voice_en_20133426,Common Voice,Not all areas of Kananaskis Country are covered by the same measure of protection.,0,,
common_voice_en_20037159,Common Voice,"ÔÇÿWho is he, you scoundrel,ÔÇÖ interposed Wardle.",1,,
common_voice_en_17558563,Common Voice,The cat knows well whose lips she licks.,0,,
common_voice_en_19523178,Common Voice,Nobody but a fool is ever rude to a good doctor.,0,,
common_voice_en_114694,Common Voice,You're worth more dead than alive.,1,,
common_voice_en_18618574,Common Voice,You can become free of debt sooner if you repay the smallest debt first.,0,,
common_voice_en_357262,Common Voice,He had to spit some tobacco out of his mouth.,0,,
common_voice_en_21284917,Common Voice,The allegation of excessive force was unfounded.,0,,
common_voice_en_220128,Common Voice,"Air was either entering or escaping at the rim with a thin, sizzling sound.",0,,
common_voice_en_18466913,Common Voice,The past participle of freeze is frozen.,0,,
common_voice_en_20311539,Common Voice,The label gained international acclaim by its minimalist electronic releases.,0,,
common_voice_en_21336059,Common Voice,"This condensation may then freeze onto the coil, reducing its heat transfer capacity.",0,,
common_voice_en_20523759,Common Voice,Their properties were therefore linked to the construction of frame fields on spheres.,0,,
common_voice_en_482008,Common Voice,Do you think your boyfriend is cheating on you?,0,,
common_voice_en_18038260,Common Voice,"Security, kick this guy out!",1,,
common_voice_en_20044080,Common Voice,"In return, Scott appointed him second-in-command, as well as Captain of the ""Terra Nova"".",0,,
common_voice_en_42351,Common Voice,A half a heelot!,1,,
common_voice_en_18325826,Common Voice,He caught himself with a jerk.,0,,
common_voice_en_20052393,Common Voice,However Belgian career diplomat Koen Vervaeke was appointed to this role instead.,0,,
common_voice_en_553157,Common Voice,Why don't you shut up!,1,,
common_voice_en_118428,Common Voice,You're worth more dead than alive.,1,,
common_voice_en_23662215,Common Voice,The reservoir is fenced and closed to all public access.,0,,
common_voice_en_23800601,Common Voice,He was a distant cousin of inventor Nathan Stubblefield.,0,,
common_voice_en_15580461,Common Voice,"They're silly, their buckets are over there behind mine.",1,,
common_voice_en_496685,Common Voice,The devil take him!,0,,
common_voice_en_547141,Common Voice,Let me out of here!,0,,
common_voice_en_115959,Common Voice,"""There are many languages spoken by things,"" the boy said.",0,,
common_voice_en_130778,Common Voice,I looked at the cylinder again and was completely terrified.,0,,
common_voice_en_617491,Common Voice,I am sorry for it.,0,,
common_voice_en_215752,Common Voice,But can we trust him?,0,,
common_voice_en_20661268,Common Voice,"He was born in Cranborne, Dorset.",0,,
common_voice_en_72236,Common Voice,"Take a sponge, some dish liquid and a towel, then get to work!",0,,
common_voice_en_433391,Common Voice,The fence post shattered.,0,,
common_voice_en_184277,Common Voice,Wasting my time listening to this mad hatter.,1,,
common_voice_en_17489488,Common Voice,"I like the avenger of the new episode, he really is a badass.",0,,
common_voice_en_19796730,Common Voice,The school's Associate Student Body organizes events and dances.,0,,
common_voice_en_19949771,Common Voice,It lies between Sandy Lodge Golf Course and Moor Park.,0,,
common_voice_en_154933,Common Voice,I didn't have time to get some stylish underwear.,0,,
common_voice_en_19239130,Common Voice,He's a raving maniac.,1,,
common_voice_en_618632,Common Voice,What about Higgins against Becca?,0,,
common_voice_en_19497024,Common Voice,"Some came running, others could only crawl.",0,,
common_voice_en_21766360,Common Voice,What's New Pussycat?,1,,
common_voice_en_18790913,Common Voice,Some people are also eligible for corporate retirement allowances.,0,,
common_voice_en_17255051,Common Voice,Is he a drunkard or what?,1,,
common_voice_en_18331648,Common Voice,"Such a dog the wise driver kills, or turns loose.",0,,
common_voice_en_23380950,Common Voice,The agreement formally created the International Copper Cartel.,0,,
common_voice_en_17389423,Common Voice,"They're silly, their buckets are over there behind mine.",1,,
common_voice_en_504041,Common Voice,You've got the brain of a pancake.,1,,
common_voice_en_23911979,Common Voice,The plant's final products were the Ford Ranger pickup truck.,0,,
common_voice_en_21690068,Common Voice,We die under your stone ceilings!,0,,
common_voice_en_19487834,Common Voice,Morphine may be helpful for longer periods of time.,0,,
common_voice_en_17280845,Common Voice,"Security, kick this guy out!",1,,
common_voice_en_17826318,Common Voice,Her body was lost among the many others in the city morgue.,0,,
common_voice_en_17264941,Common Voice,"Jeez, you look stoned!",1,,
