FileName,Dataset,text,label2a,Starting,Ending
common_voice_en_17972741,Common Voice,We need to ski down the hill before the sun sets.,0,,
common_voice_en_311718,Common Voice,The mall is open eight thirty AM to five thirty PM.,0,,
common_voice_en_683899,Common Voice,Adam is a crook.,1,,
common_voice_en_19246555,Common Voice,ÔÇÿDamned ÔÇö thou saucy witch!ÔÇÖ he replied.,1,,
common_voice_en_494355,Common Voice,A content delivery network is necessary.,0,,
common_voice_en_110636,Common Voice,How about some wine?,0,,
common_voice_en_17275885,Common Voice,Did you see him?,0,,
common_voice_en_24015091,Common Voice,Kenny made the decision as well.,0,,
common_voice_en_17386483,Common Voice,Is he a drunkard or what?,1,,
common_voice_en_203835,Common Voice,"Penny wise, pound foolish.",1,,
common_voice_en_18125263,Common Voice,"Never advertise razors by shaving a monkey, it's cruel and results in lawsuits.",0,,
common_voice_en_677542,Common Voice,What's the matter with everybody?,0,,
common_voice_en_18514666,Common Voice,"Give yourself a pat on the back, you deserve it.",0,,
common_voice_en_148855,Common Voice,It was complete idiocy.,1,,
common_voice_en_17730080,Common Voice,"Security, kick this guy out!",1,,
common_voice_en_20025246,Common Voice,A major component of the Walkman advertising campaign was personalization of the device.,0,,
common_voice_en_18111713,Common Voice,"Look, the seam is now broken, it couldn't stand the jerk.",0,,
common_voice_en_18706956,Common Voice,Die!,1,,
common_voice_en_17843859,Common Voice,"Since it's been repaired, the car hasn't shown the issue any more.",0,,
common_voice_en_249477,Common Voice,Don't be so silly!,1,,
common_voice_en_19637228,Common Voice,I had to watch her die slowly of cancer for a whole year.,0,,
common_voice_en_23874764,Common Voice,Do something!,0,,
common_voice_en_680068,Common Voice,A hand holding a nail file files someone 's nail over a peach towel.,0,,
common_voice_en_23863217,Common Voice,"Today, little remains of Winton's railway, though its route can be discerned.",0,,
common_voice_en_20220569,Common Voice,"Bean also played the villain's twin brother, Reese.",0,,
common_voice_en_20272829,Common Voice,De Guisson assumed the managerial position full-time shortly after.,0,,
common_voice_en_18123324,Common Voice,Quit whining!,1,,
common_voice_en_21014719,Common Voice,"Specifically, the player could solicit intercourse from a virtual prostitute, and then kill her.",0,,
common_voice_en_18518657,Common Voice,"Won't you draw up, gentlemen.",0,,
common_voice_en_18647115,Common Voice,"""Let me see,"" said Richard, looking at his watch.",0,,
common_voice_en_17887736,Common Voice,"Jerk the cord, and out tumbles the gold.",0,,
common_voice_en_23681298,Common Voice,The bands may overlap.,0,,
common_voice_en_17450745,Common Voice,"Actually, quietness is my normal mode in most situations.",0,,
common_voice_en_21724429,Common Voice,Many visitors access the park by boat either from Bumi Hills or Kariba town.,0,,
common_voice_en_23349457,Common Voice,He led the opposition to the Socialist Spanish government over abortion and same-sex marriage.,0,,
common_voice_en_17777001,Common Voice,Why can't I skip this damn intro?,1,,
common_voice_en_18480189,Common Voice,ÔÇÿWhat size do you want to be?ÔÇÖ it asked.,0,,
common_voice_en_20519587,Common Voice,Former Interior Minister Almasbei Kchach was one of two suspects who subsequently committed suicide.,0,,
common_voice_en_17395895,Common Voice,"It was harassment, pure and simple.",0,,
common_voice_en_19801212,Common Voice,"""Your own last breath"", ""no use"".",0,,
common_voice_en_469916,Common Voice,"The grim reaper is waiting for you, reckless driver!",1,,
common_voice_en_21081738,Common Voice,Lack of snakes caused introduced and invasive toads to flourish and rampant.,0,,
common_voice_en_23436026,Common Voice,"After the war, Redmond's expansion began in earnest.",0,,
common_voice_en_593482,Common Voice,"""There are rumors of tribal wars,"" he told them.",0,,
common_voice_en_18963381,Common Voice,Thrombosis of the cerebral vein is often deadly but can be survived.,0,,
common_voice_en_428256,Common Voice,A bully is always a coward.,1,,
common_voice_en_16049222,Common Voice,The wise man is deceived once but the fool twice.,0,,
common_voice_en_201020,Common Voice,The omens had told him so.,0,,
common_voice_en_12705,Common Voice,Then the thing came upon him in a flash.,0,,
common_voice_en_84272,Common Voice,A man wearing a blue tanktop is in the park striking a pose.,0,,
common_voice_en_629194,Common Voice,"Yours sincerely, satan.",0,,
common_voice_en_19260703,Common Voice,It serves the Brisbane suburb of Sherwood.,0,,
common_voice_en_17147584,Common Voice,What idiot wrote this total drivel?,1,,
common_voice_en_23171320,Common Voice,"If we could wipe out homosexual practices, then Aids would die out.",1,,
common_voice_en_18129355,Common Voice,Don't be so silly!,1,,
common_voice_en_17422820,Common Voice,What idiot wrote this total drivel?,1,,
common_voice_en_694738,Common Voice,"""What a load of trash"", Sarah opined.",1,,
common_voice_en_545078,Common Voice,A lone woman walks in the surf at the beach.,0,,
common_voice_en_191394,Common Voice,I just want to dream about Mecca.,0,,
common_voice_en_23793446,Common Voice,People die of disease and accident.,0,,
common_voice_en_18335814,Common Voice,His office was on the top floor of C building.,0,,
common_voice_en_17263550,Common Voice,"Those women are all card sharks, don't be fooled.",1,,
common_voice_en_612781,Common Voice,She's a feisty little ferret.,0,,
common_voice_en_646824,Common Voice,The weather in Finland sucks.,1,,
common_voice_en_638318,Common Voice,I'm not interested in your book.,0,,
common_voice_en_10676101,Common Voice,The bill for subsidized healthcare was tabled last week.,0,,
common_voice_en_529569,Common Voice,He's insane or drunk or something.,1,,
common_voice_en_524496,Common Voice,"Those women are all card sharks, don't be fooled.",1,,
common_voice_en_24035099,Common Voice,It is only officially available for the Microsoft Windows operating system.,0,,
common_voice_en_551194,Common Voice,Don't be so silly!,1,,
common_voice_en_194977,Common Voice,You could save that poor devil's life.,1,,
common_voice_en_17851495,Common Voice,To wait and be patient soothes many a pang.,0,,
common_voice_en_700347,Common Voice,Hundreds of yelling people are swarming into the park like locusts!,1,,
common_voice_en_22384340,Common Voice,Converts from non-Christian religions also need to be baptized before chrismation.,0,,
common_voice_en_17978548,Common Voice,Dots of light betrayed the black cat.,0,,
common_voice_en_18324695,Common Voice,His rubbish was taken away in the dustcart,1,,
common_voice_en_635022,Common Voice,YOU WANNA TAKE THIS OUTSIDE?,0,,
common_voice_en_83891,Common Voice,Why don't you shut up!,1,,
common_voice_en_190260,Common Voice,"Among these people were a couple of cyclists, a gardener I employed sometimes, and a girl carrying a baby.",0,,
common_voice_en_158468,Common Voice,The fool flew all the way up here in a blizzard.,1,,
common_voice_en_18340007,Common Voice,A Bank Holiday in Britain is like a public holiday in America,0,,
common_voice_en_17984833,Common Voice,"""How many hens are there for one cock?"", I asked the farmer.",0,,
common_voice_en_17654296,Common Voice,"The grim reaper is waiting for you, reckless driver!",1,,
common_voice_en_20287796,Common Voice,The boxset was also released on iTunes.,0,,
common_voice_en_18495497,Common Voice,Devilled eggs taste horrible.,0,,
common_voice_en_84376,Common Voice,A boy in goggles plays with a readhaired girl.,0,,
common_voice_en_17731187,Common Voice,The everlasting Jew the wandering Jew.,0,,
common_voice_en_18116696,Common Voice,"""What a load of trash"", Sarah opined.",1,,
common_voice_en_18122182,Common Voice,"Darling, we've run out of avocados!",0,,
common_voice_en_82793,Common Voice,Maybe he really is a fool.,1,,
common_voice_en_588772,Common Voice,It was only when I got this close to it that the strangeness of it was at all evident to me.,0,,
common_voice_en_539975,Common Voice,You are so rude!,1,,
common_voice_en_119517,Common Voice,Why don't you shut up!,1,,
common_voice_en_21868295,Common Voice,"If the person who was warned enters Forest again, Forest will kill them.",0,,
common_voice_en_39131,Common Voice,I SHALL MAKE US SOME ICE CUBES.,0,,
common_voice_en_572307,Common Voice,I was torn between fear and curiosity.,0,,
common_voice_en_18628537,Common Voice,A priest and nun walked past us earlier.,0,,
common_voice_en_18530118,Common Voice,It is not your fault that you have sprained your brain.,0,,
common_voice_en_17903319,Common Voice,"Penny wise, pound foolish.",1,,
common_voice_en_21768805,Common Voice,The property was later used by Canada Post as a distribution centre.,0,,
common_voice_en_17254952,Common Voice,"As a workaround, we could use application specific profiles.",0,,
common_voice_en_17248459,Common Voice,"Don't knock on death's door, ring the doorbell and run.",0,,
common_voice_en_17875108,Common Voice,The wise man is deceived once but the fool twice.,0,,
common_voice_en_17285307,Common Voice,"Have you finished with the Annual Report, Jane?",0,,
common_voice_en_19600124,Common Voice,"Downing, but he wasn't in the house.",0,,
common_voice_en_23735900,Common Voice,Presently it does not include historic ferry crossings.,0,,
common_voice_en_18165237,Common Voice,Never look a gift horse in the mouth.,0,,
common_voice_en_18717420,Common Voice,Constant maturity swaps can either be single currency or cross currency swaps.,0,,
common_voice_en_21554976,Common Voice,Try to stop me if you can you stupid police...,1,,
common_voice_en_17362485,Common Voice,To be the cock in the basket to be cock of the company.,0,,
common_voice_en_72047,Common Voice,Don't be an idiot!,1,,
common_voice_en_17254072,Common Voice,"They're silly, their buckets are over there behind mine.",1,,
common_voice_en_19765428,Common Voice,"Both Hinduism and Buddhism emphasize that one overcomes ""dukha"" through the development of understanding.",0,,
common_voice_en_18125196,Common Voice,What idiot wrote this total drivel?,1,,
common_voice_en_659621,Common Voice,"Looking through the telescope, I saw a circle of deep blue and the little round planet.",0,,
common_voice_en_20120613,Common Voice,"He has no friends, and dismisses women as weak and inferior.",1,,
common_voice_en_20820964,Common Voice,A large number of civilians were raped or killed during the pillage.,0,,
common_voice_en_573197,Common Voice,"The boy offered his bottle, hoping that the old man would leave him alone.",0,,
common_voice_en_591341,Common Voice,And I still claim I was right the night I proposed.,0,,
common_voice_en_24013353,Common Voice,Short cervical length is the strongest predictor of preterm birth.,0,,
common_voice_en_19114403,Common Voice,It seeks unspecified damages.,0,,
common_voice_en_175393,Common Voice,The place is so full of cockroaches.,0,,
common_voice_en_18981359,Common Voice,"However, Japan retained economic influence in the area.",0,,
common_voice_en_21049574,Common Voice,Andy is deemed a coward and shot by a Confederate major.,1,,
common_voice_en_650639,Common Voice,He's already got charge of the bank.,0,,
common_voice_en_151444,Common Voice,"He thought about asking him to give it back, but decided that would be unfriendly.",0,,
common_voice_en_34806,Common Voice,"""The alchemist is two hundred years old,"" the Englishman had told him.",0,,
common_voice_en_22708390,Common Voice,Helmsdale is on the east-facing North Sea coast of Britain.,0,,
common_voice_en_17281908,Common Voice,"Excuse me, where may I find some Accounting books to borrow?",0,,
common_voice_en_22463441,Common Voice,"His first novel ""A Nest of Singing Birds"" was awarded the prestigious Litchfield Prize.",0,,
common_voice_en_21934975,Common Voice,six,0,,
common_voice_en_542,Common Voice,I will need some sheet music if you want me to play that.,0,,
common_voice_en_1369439,Common Voice,Why can't I skip this damn intro?,1,,
common_voice_en_524819,Common Voice,Take your paws off me!,1,,
common_voice_en_18606774,Common Voice,And his father is dependent on him in the Vale of Taunton.,0,,
common_voice_en_513124,Common Voice,Take your paws off me!,1,,
common_voice_en_19205685,Common Voice,Most yaoi fans are either teenage girls or young women.,0,,
common_voice_en_23737505,Common Voice,"Tell it to your face, you ain't nuttin but a faker!",1,,
common_voice_en_23868587,Common Voice,The egg and tadpole stages of its lifecycle are relatively short.,0,,
common_voice_en_652116,Common Voice,"Some people like sea gulls, others don't.",0,,
common_voice_en_685268,Common Voice,"Roger, the backup team is on the way.",0,,
common_voice_en_18976644,Common Voice,"However, this did not lead to a new series of ""The Beachcombers"".",0,,
common_voice_en_17403375,Common Voice,Her niece is a diabetic.,0,,
common_voice_en_597284,Common Voice,"Somebody should eat the mango, I guess it is me.",0,,
common_voice_en_585919,Common Voice,I don't want to kill anybody.,0,,
common_voice_en_87730,Common Voice,Don't be an idiot!,1,,
common_voice_en_22746572,Common Voice,"She is sexually innocent, oblivious to the worldliness around her.",0,,
common_voice_en_23860098,Common Voice,The islanders capture him and shun the Baudelaires for their possessing forbidden items.,0,,
common_voice_en_17290527,Common Voice,"I like apples, pears, and pomegranate, but I do like strawberries or grapes.",0,,
common_voice_en_17412329,Common Voice,"Those women are all card sharks, don't be fooled.",1,,
common_voice_en_19100199,Common Voice,The town is the seat of the Shire of Waroona.,0,,
common_voice_en_513893,Common Voice,One of the worst crooks in town!,0,,
common_voice_en_19422652,Common Voice,"He is also well known for his poem, Father and Son.",0,,
common_voice_en_17563878,Common Voice,"""What a load of trash"", Sarah opined.",1,,
common_voice_en_20290149,Common Voice,"Despite this setback, within a year Evans had found a client.",0,,
common_voice_en_585739,Common Voice,Mark untaped the package carefully.,0,,
common_voice_en_192804,Common Voice,Don't you know that girl's very sick?,0,,
common_voice_en_18066227,Common Voice,Better be ignorant than obstinate.,0,,
common_voice_en_19080403,Common Voice,His column was syndicated to other newspapers around the country.,0,,
common_voice_en_23785236,Common Voice,"The manufacturer enslaves man, but robots free us.",0,,
common_voice_en_531792,Common Voice,Do you read me?,0,,
common_voice_en_57357,Common Voice,I locked eyes with a fish in the tank.,0,,
common_voice_en_19410640,Common Voice,Obrigwabibikwa is a dwarf who can change himself into a reptile.,0,,
common_voice_en_18662839,Common Voice,And there I see him waiting to be summoned.,0,,
common_voice_en_481049,Common Voice,"They're silly, their buckets are over there behind mine.",1,,
common_voice_en_18453453,Common Voice,His clothes are really outrageous. He's a one-off,1,,
common_voice_en_23859551,Common Voice,"One release, a gold-selling album called Watch It, Sucker!",0,,
common_voice_en_19514379,Common Voice,Business diminished after the Turner Turnpike diverted cross-country traffic from the town's main street.,0,,
common_voice_en_17260353,Common Voice,Where did Charlotte leave her keys?,0,,
common_voice_en_622817,Common Voice,Something inside the cylinder was unscrewing the top.,0,,
common_voice_en_20505016,Common Voice,Major irrigation projects located in the plains permit double-cropping.,0,,
common_voice_en_21181955,Common Voice,These are designed from the start as dedicated subsonic projectile systems.,0,,
common_voice_en_19712752,Common Voice,The rats worship him and do his dark bidding.,0,,
common_voice_en_19196731,Common Voice,The matha is cared for by both Muslims and Hindus.,0,,
common_voice_en_20863279,Common Voice,"Nevertheless, the Marine Corps did deploy women to Hawaii.",0,,
common_voice_en_17407029,Common Voice,"The more you stir, the more it stinks.",0,,
common_voice_en_689560,Common Voice,"""Everything in the universe evolved,"" he said.",0,,
common_voice_en_213063,Common Voice,Let me formulate a response to that question.,0,,
common_voice_en_22510672,Common Voice,"In Indonesian, sometimes ya?",0,,
common_voice_en_21135944,Common Voice,This conjecture is now known to be false.,0,,
common_voice_en_23688003,Common Voice,"Eventually, an unknown force begins to attack and murder several of the townspeople.",0,,
common_voice_en_23377287,Common Voice,"It is claimed that he has many more children, which are also Oneiroi.",0,,
common_voice_en_217791,Common Voice,Two older people have a discussion on a street.,0,,
common_voice_en_18117963,Common Voice,"You're not psychotic, you just wish you were?",1,,
common_voice_en_18746055,Common Voice,The party was supposed to be less conservative and more modern that its predecessor.,0,,
common_voice_en_18423052,Common Voice,You were destroying my life.,1,,
common_voice_en_22707352,Common Voice,"Begone, you vagabond!",1,,
common_voice_en_18124889,Common Voice,"By accepting our privacy policy, you agree that we save your data for twenty-one days to detect frauds.",0,,
common_voice_en_647849,Common Voice,With that new haircut you look ridiculous.,1,,
common_voice_en_697941,Common Voice,Maybe he really is a fool.,1,,
common_voice_en_20496019,Common Voice,"Eventually though he repeated the age-old error, he spent far more than he collected.",0,,
common_voice_en_18139079,Common Voice,A penny wise and a pound foolish.,1,,
common_voice_en_2354514,Common Voice,He who wronged you will hate you.,0,,
common_voice_en_17325152,Common Voice,"""Never to come on a green twig;"" not to get on in the world.",0,,
common_voice_en_17258395,Common Voice,"Well, I don't know.",0,,
common_voice_en_22485550,Common Voice,A lot of people are about to look very silly.,1,,
common_voice_en_615874,Common Voice,Please take a business card.,0,,
common_voice_en_22752584,Common Voice,It was the first album recorded with Kicks on bass.,0,,
common_voice_en_487822,Common Voice,What good is money to you if you're going to die?,0,,
common_voice_en_63628,Common Voice,A half a heelot!,1,,
common_voice_en_17298725,Common Voice,"It was sprayed in red, with yellow edges.",0,,
common_voice_en_23612396,Common Voice,"On the day of the audit release, the Dean of education committed suicide.",0,,
common_voice_en_15735017,Common Voice,Dip the pail once and let it settle.,0,,
common_voice_en_8237501,Common Voice,You ain't gonna ruin this heist!,0,,
common_voice_en_138484,Common Voice,I often wish you weren't such a stinker.,1,,
common_voice_en_193431,Common Voice,You get somebody else to wash the diapers.,0,,
common_voice_en_522525,Common Voice,That insane android continues to ignore me.,1,,
common_voice_en_18101131,Common Voice,The play seems dull and quite stupid.,1,,
common_voice_en_638419,Common Voice,Someone set fire to the trash.,0,,
common_voice_en_650999,Common Voice,The play seems dull and quite stupid.,1,,
common_voice_en_538240,Common Voice,Look for a photograph of I Wanna Sex You Up,0,,
common_voice_en_15758224,Common Voice,They felt gay when the ship arrived in port.,0,,
common_voice_en_19788054,Common Voice,Twenty-three of these are included in the Antebellum Homes in Eutaw multiple property submission.,0,,
common_voice_en_16665943,Common Voice,Every cock crows loud on his own dunghill.,0,,
common_voice_en_18422999,Common Voice,"If you are stupid enough to do that, I can't guarantee your safety.",1,,
common_voice_en_668099,Common Voice,Adam is a crook.,1,,
common_voice_en_19500056,Common Voice,Carl Rogers' ideas about the formation of the individual also contributed to student-centered learning.,0,,
common_voice_en_20834204,Common Voice,It impounds the Tellico Reservoir.,0,,
common_voice_en_17456076,Common Voice,What idiot wrote this total drivel?,1,,
common_voice_en_4200058,Common Voice,Her low self-esteem is pathetic.,1,,
common_voice_en_150151,Common Voice,Let me out of here!,0,,
common_voice_en_175023,Common Voice,I've watched you grow up from a little boy.,0,,
common_voice_en_104254,Common Voice,At least we've finally got something we can celebrate.,0,,
common_voice_en_18176711,Common Voice,Don't try to teach your grand-mother to suck eggs.,0,,
common_voice_en_20850881,Common Voice,"However, two passages may have been inserted at a later stage.",0,,
common_voice_en_665362,Common Voice,He'll drive you batty!,0,,
common_voice_en_262527,Common Voice,You are so rude!,1,,
common_voice_en_146280,Common Voice,And that's another thing.,0,,
common_voice_en_515431,Common Voice,Take your paws off me!,1,,
common_voice_en_22156308,Common Voice,The women trick their way into the architect's house and kill him.,0,,
common_voice_en_686552,Common Voice,I'll kill both of them!,1,,
common_voice_en_19411509,Common Voice,"The new product included both the original ""Rise of Nations"" and ""Thrones and Patriots"".",0,,
common_voice_en_489919,Common Voice,I donÔÇÖt know how comfortable it would be for a person.,0,,
common_voice_en_582225,Common Voice,"Nora finds herself ugly, because she has pimples.",0,,
common_voice_en_618706,Common Voice,"Never advertise razors by shaving a monkey, it's cruel and results in lawsuits.",0,,
common_voice_en_21051585,Common Voice,The losers will have to sit at tables near the school's dumpsters.,0,,
common_voice_en_17286599,Common Voice,What should he do?,0,,
common_voice_en_619992,Common Voice,The play seems dull and quite stupid.,1,,
common_voice_en_15781939,Common Voice,It's wicked how Lara neglects her pussy cat.,0,,
common_voice_en_19641542,Common Voice,That ferry has long since been discontinued.,0,,
common_voice_en_17990929,Common Voice,"I sucked at it, but it was much more fun than most normal chess games.",0,,
common_voice_en_18242970,Common Voice,There's a group of unruly teens bumming around in your garden.,1,,
common_voice_en_20296227,Common Voice,"""Don Cleto"" began his political career at a young age.",0,,
common_voice_en_19718138,Common Voice,"There was no single or canonical ""Book of the Dead"".",0,,
common_voice_en_98851,Common Voice,He's nuts about you.,0,,
common_voice_en_93198,Common Voice,"Those women are all card sharks, don't be fooled.",1,,
common_voice_en_23827930,Common Voice,"What say you, Mary?",0,,
common_voice_en_17843811,Common Voice,My children are all scoundrels.,1,,
common_voice_en_17285027,Common Voice,Am Montag beginnt die neue Staffel.,0,,
common_voice_en_207928,Common Voice,A fool and his money are soon parted.,0,,
common_voice_en_588900,Common Voice,The toad spit a caustic slime at the bees.,0,,
common_voice_en_24066873,Common Voice,"As mentioned in his memoir ""Blue Box Boy"" he is a homosexual.",0,,
common_voice_en_17321725,Common Voice,"You know, singing karaoke with you makes me realize how good of a singer I am.",0,,
common_voice_en_23878959,Common Voice,Some models of handgun-mounted lights have an integrated laser sight.,0,,
common_voice_en_101908,Common Voice,He's already got charge of the bank.,0,,
common_voice_en_19918001,Common Voice,"Her eyes dilated, became exposed and palpitating.",0,,
common_voice_en_20026590,Common Voice,It had two main aspects.,0,,
common_voice_en_15738996,Common Voice,What idiot wrote this total drivel?,1,,
common_voice_en_17994842,Common Voice,My children are all scoundrels.,1,,
common_voice_en_106262,Common Voice,Keep your mouth shut and your eyes open.,0,,
common_voice_en_15971,Common Voice,I often wish you weren't such a stinker.,1,,
common_voice_en_126508,Common Voice,"It's almost as if he had been here and left his mark, he thought.",0,,
common_voice_en_23625494,Common Voice,In it Barrett sought interested people wanting to help form his magic circle.,0,,
common_voice_en_18435658,Common Voice,The idiots are in charge.,1,,
common_voice_en_562033,Common Voice,They play duets together.,0,,
common_voice_en_17325366,Common Voice,"Penny wise, pound foolish.",1,,
common_voice_en_19389610,Common Voice,"It has a stocky body and a broad, rounded snout.",0,,
common_voice_en_22969359,Common Voice,"Part of the labor movement internationally, the Workers' Party wishes to achieve socialism.",0,,
common_voice_en_23763933,Common Voice,"Then, he took that patty and put it down on the black-iron skillet.",0,,
common_voice_en_18734065,Common Voice,The parish falls within the 'Bathavon South' electoral ward.,0,,
common_voice_en_22459515,Common Voice,It is awarded to the best interior design in a film.,0,,
common_voice_en_132376,Common Voice,Put down that chair!,0,,
common_voice_en_646221,Common Voice,"Those women are all card sharks, don't be fooled.",1,,
common_voice_en_19294712,Common Voice,Asphalt was imported from Germany to complete the project.,0,,
common_voice_en_509107,Common Voice,You are super talented and should submit right away.,0,,
common_voice_en_17735767,Common Voice,"You two in the last row, stop giggling!",0,,
common_voice_en_19979570,Common Voice,Dead leukocytes will remain as a creamy yellow pus.,0,,
common_voice_en_17841487,Common Voice,What a bummer!,0,,
common_voice_en_19591794,Common Voice,What a charming little monkey!,0,,
common_voice_en_20731316,Common Voice,The book is a fraud.,1,,
common_voice_en_645687,Common Voice,Then what did you do?,0,,
common_voice_en_490722,Common Voice,Let's hope you don't have to vomit.,0,,
common_voice_en_18344528,Common Voice,You were destroying my life.,1,,
common_voice_en_108718,Common Voice,This is my last chance.,0,,
common_voice_en_208949,Common Voice,"You'll live, and you'll learn that a man shouldn't be so stupid.",0,,
common_voice_en_606196,Common Voice,You've got the brain of a pancake.,1,,
